{
  "schema_version": "0.1",
  "id": "F-000001",
  "created_at": "2026-10-02T14:45:26.316Z",
  "updated_at": "2026-10-10T05:39:39.980Z",
  "scope": "personal",
  "type": "note",
  "status": "active",
  "priority": "none",
  "urgency": "none",
  "domains": [
    "ai",
    "knowledge-management"
  ],
  "tags": [],
  "project": null,
  "related": [],
  "title": "1",
  "summary": "1",
  "next_action": null,
  "original_input": "1",
  "notes": null,
  "interview": [],
  "source": {
    "channel": "web"
  },
  "ai": {
    "classification_confirmed": true,
    "interview_used": false
  }
}
